{
  "$id": "https://superdeck.dev/schema/superdeck.slides.schema.json",
  "$schema": "https://json-schema.org/draft/2020-12/schema",
  "items": {
    "additionalProperties": false,
    "properties": {
      "comments": {
        "default": [],
        "items": {
          "type": "string"
        },
        "type": "array"
      },
      "key": {
        "type": "string"
      },
      "options": {
        "anyOf": [
          {
            "additionalProperties": true,
            "properties": {
              "layout": {
                "anyOf": [
                  {
                    "enum": [
                      "normal",
                      "fullscreen"
                    ],
                    "type": "string"
                  },
                  {
                    "type": "null"
                  }
                ]
              },
              "style": {
                "anyOf": [
                  {
                    "type": "string"
                  },
                  {
                    "type": "null"
                  }
                ]
              },
              "template": {
                "anyOf": [
                  {
                    "type": "string"
                  },
                  {
                    "type": "null"
                  }
                ]
              },
              "title": {
                "anyOf": [
                  {
                    "type": "string"
                  },
                  {
                    "type": "null"
                  }
                ]
              }
            },
            "type": "object",
            "x-transformed": true
          },
          {
            "type": "null"
          }
        ]
      },
      "sections": {
        "default": [],
        "items": {
          "additionalProperties": false,
          "properties": {
            "align": {
              "anyOf": [
                {
                  "enum": [
                    "topLeft",
                    "topCenter",
                    "topRight",
                    "centerLeft",
                    "center",
                    "centerRight",
                    "bottomLeft",
                    "bottomCenter",
                    "bottomRight"
                  ],
                  "type": "string"
                },
                {
                  "type": "null"
                }
              ]
            },
            "blocks": {
              "items": {
                "anyOf": [
                  {
                    "additionalProperties": false,
                    "properties": {
                      "align": {
                        "anyOf": [
                          {
                            "enum": [
                              "topLeft",
                              "topCenter",
                              "topRight",
                              "centerLeft",
                              "center",
                              "centerRight",
                              "bottomLeft",
                              "bottomCenter",
                              "bottomRight"
                            ],
                            "type": "string"
                          },
                          {
                            "type": "null"
                          }
                        ]
                      },
                      "content": {
                        "type": "string"
                      },
                      "flex": {
                        "default": 1,
                        "exclusiveMinimum": 0,
                        "type": "integer"
                      },
                      "margin": {
                        "anyOf": [
                          {
                            "additionalProperties": false,
                            "properties": {
                              "bottom": {
                                "minimum": 0,
                                "type": "number",
                                "x-transformed": true
                              },
                              "left": {
                                "minimum": 0,
                                "type": "number",
                                "x-transformed": true
                              },
                              "right": {
                                "minimum": 0,
                                "type": "number",
                                "x-transformed": true
                              },
                              "top": {
                                "minimum": 0,
                                "type": "number",
                                "x-transformed": true
                              }
                            },
                            "required": [
                              "top",
                              "right",
                              "bottom",
                              "left"
                            ],
                            "type": "object",
                            "x-transformed": true
                          },
                          {
                            "type": "null"
                          }
                        ]
                      },
                      "padding": {
                        "anyOf": [
                          {
                            "additionalProperties": false,
                            "properties": {
                              "bottom": {
                                "minimum": 0,
                                "type": "number",
                                "x-transformed": true
                              },
                              "left": {
                                "minimum": 0,
                                "type": "number",
                                "x-transformed": true
                              },
                              "right": {
                                "minimum": 0,
                                "type": "number",
                                "x-transformed": true
                              },
                              "top": {
                                "minimum": 0,
                                "type": "number",
                                "x-transformed": true
                              }
                            },
                            "required": [
                              "top",
                              "right",
                              "bottom",
                              "left"
                            ],
                            "type": "object",
                            "x-transformed": true
                          },
                          {
                            "type": "null"
                          }
                        ]
                      },
                      "scrollable": {
                        "default": false,
                        "type": "boolean"
                      },
                      "type": {
                        "const": "block",
                        "type": "string"
                      }
                    },
                    "required": [
                      "type"
                    ],
                    "type": "object"
                  },
                  {
                    "additionalProperties": true,
                    "properties": {
                      "align": {
                        "anyOf": [
                          {
                            "enum": [
                              "topLeft",
                              "topCenter",
                              "topRight",
                              "centerLeft",
                              "center",
                              "centerRight",
                              "bottomLeft",
                              "bottomCenter",
                              "bottomRight"
                            ],
                            "type": "string"
                          },
                          {
                            "type": "null"
                          }
                        ]
                      },
                      "flex": {
                        "default": 1,
                        "exclusiveMinimum": 0,
                        "type": "integer"
                      },
                      "margin": {
                        "anyOf": [
                          {
                            "additionalProperties": false,
                            "properties": {
                              "bottom": {
                                "minimum": 0,
                                "type": "number",
                                "x-transformed": true
                              },
                              "left": {
                                "minimum": 0,
                                "type": "number",
                                "x-transformed": true
                              },
                              "right": {
                                "minimum": 0,
                                "type": "number",
                                "x-transformed": true
                              },
                              "top": {
                                "minimum": 0,
                                "type": "number",
                                "x-transformed": true
                              }
                            },
                            "required": [
                              "top",
                              "right",
                              "bottom",
                              "left"
                            ],
                            "type": "object",
                            "x-transformed": true
                          },
                          {
                            "type": "null"
                          }
                        ]
                      },
                      "name": {
                        "type": "string"
                      },
                      "padding": {
                        "anyOf": [
                          {
                            "additionalProperties": false,
                            "properties": {
                              "bottom": {
                                "minimum": 0,
                                "type": "number",
                                "x-transformed": true
                              },
                              "left": {
                                "minimum": 0,
                                "type": "number",
                                "x-transformed": true
                              },
                              "right": {
                                "minimum": 0,
                                "type": "number",
                                "x-transformed": true
                              },
                              "top": {
                                "minimum": 0,
                                "type": "number",
                                "x-transformed": true
                              }
                            },
                            "required": [
                              "top",
                              "right",
                              "bottom",
                              "left"
                            ],
                            "type": "object",
                            "x-transformed": true
                          },
                          {
                            "type": "null"
                          }
                        ]
                      },
                      "scrollable": {
                        "default": false,
                        "type": "boolean"
                      },
                      "type": {
                        "const": "widget",
                        "type": "string"
                      }
                    },
                    "required": [
                      "type",
                      "name"
                    ],
                    "type": "object"
                  }
                ],
                "x-transformed": true
              },
              "type": "array"
            },
            "flex": {
              "default": 1,
              "exclusiveMinimum": 0,
              "type": "integer"
            },
            "spacing": {
              "default": 0.0,
              "minimum": 0,
              "type": "number",
              "x-transformed": true
            },
            "type": {
              "const": "section",
              "default": "section",
              "type": "string"
            }
          },
          "type": "object",
          "x-transformed": true
        },
        "type": "array"
      }
    },
    "required": [
      "key"
    ],
    "type": "object",
    "x-transformed": true
  },
  "title": "Slides Contract",
  "type": "array"
}
